{
  "$schema": "https://json-schema.org/draft/2020-12/schema",
  "$id": "https://researchblocks.invalid/schemas/request.schema.json",
  "title": "ResearchBlocks bounded request",
  "$comment": "Namespace identifier only, not a live URL or owned domain. Runtime validation is authoritative: it checks unique IDs, control characters and public domain rules.",
  "type": "object",
  "required": [
    "candidates",
    "criteria",
    "max_age_hours",
    "max_cost_usd"
  ],
  "additionalProperties": false,
  "properties": {
    "candidates": {
      "type": "array",
      "minItems": 1,
      "maxItems": 3,
      "items": {
        "type": "object",
        "required": [
          "id",
          "label",
          "official_domains"
        ],
        "additionalProperties": false,
        "properties": {
          "id": {
            "type": "string",
            "pattern": "^[a-z][a-z0-9_-]{0,63}$",
            "maxLength": 64
          },
          "label": {
            "type": "string",
            "minLength": 1,
            "maxLength": 120,
            "pattern": "\\S"
          },
          "official_domains": {
            "type": "array",
            "minItems": 1,
            "maxItems": 10,
            "uniqueItems": true,
            "items": {
              "type": "string",
              "minLength": 3,
              "maxLength": 253,
              "pattern": "^[A-Za-z0-9](?:[A-Za-z0-9-]{0,61}[A-Za-z0-9])?(?:\\.[A-Za-z0-9](?:[A-Za-z0-9-]{0,61}[A-Za-z0-9])?)+$",
              "description": "Plain public DNS hostname only. Runtime additionally rejects IP/local/reserved hosts and duplicates after case normalization."
            }
          }
        }
      }
    },
    "criteria": {
      "type": "array",
      "minItems": 1,
      "maxItems": 5,
      "items": {
        "type": "object",
        "required": [
          "id",
          "question"
        ],
        "additionalProperties": false,
        "properties": {
          "id": {
            "type": "string",
            "pattern": "^[a-z][a-z0-9_-]{0,63}$",
            "maxLength": 64
          },
          "question": {
            "type": "string",
            "minLength": 1,
            "maxLength": 500,
            "pattern": "\\S"
          }
        }
      }
    },
    "max_age_hours": {
      "type": "number",
      "exclusiveMinimum": 0,
      "maximum": 8760
    },
    "max_cost_usd": {
      "type": "string",
      "pattern": "^(?:(?:0|[1-9][0-9]{0,2})(?:\\.[0-9]{1,8})?|1000(?:\\.0{1,8})?)$"
    }
  }
}
